Accession,Title,Series Type,Taxonomy,Sample Count,Datasets,Supplementary Types,Supplementary Links,PubMed ID,SRA Accession,Contact,Release Date
GSE6568,"SHREC, an Effector Complex for Heterochromatic Transcriptional Silencing","Genome binding/occupancy profiling by genome tiling array","Schizosaccharomyces pombe",10,,,,17289569,,"Shiv Grewal","Feb 08, 2007"
GSE6662,"Cardiac-specific deletion of ménage-à-trois-1 (MAT1)","Expression profiling by array","Mus musculus",15,GDS2561,"CEL","ftp://ftp.ncbi.nlm.nih.gov/geo/series/GSE6nnn/GSE6662/suppl",17276355,,"Michael Schneider","Feb 08, 2007"
GSE6946,"Transcript analysis of aluminum tolerance responses in Medicago truncatula","Expression profiling by array","Medicago truncatula",24,,,,,,"Kathryn A VandenBosch","Feb 08, 2007"
GSE6963,"Gene expression profiles of P1 ureter isolated from SMGA (Actg2) transgenic mice. (GUDMAP Series ID: 14)","Expression profiling by array","Mus musculus",4,,"CEL","ftp://ftp.ncbi.nlm.nih.gov/geo/series/GSE6nnn/GSE6963/suppl",,,"GUDMAP Developers","Feb 08, 2007"
GSE6965,"Gene expression profile of human dendritic cells after infection with A. fumigatus","Expression profiling by array","Homo sapiens",4,GDS2749,"CEL","ftp://ftp.ncbi.nlm.nih.gov/geo/series/GSE6nnn/GSE6965/suppl",18426895,,"Juergen Loeffler","Feb 08, 2007"
GSE6984,"CGH detection of chromosomal rearrangements in diploid yeast cells exposed to ionizing radiation","Genome variation profiling by genome tiling array","Saccharomyces cerevisiae",41,,"GPR","ftp://ftp.ncbi.nlm.nih.gov/geo/series/GSE6nnn/GSE6984/suppl",18701715,,"Juan Lucas Argueso","Feb 08, 2007"
GSE3751,"Circadian rhythm in clock mutants","Expression profiling by array","Mus musculus",76,,"CEL","ftp://ftp.ncbi.nlm.nih.gov/geo/series/GSE3nnn/GSE3751/suppl",17360649;17462724,,"John R Walker","Feb 07, 2007"
GSE6448,"Deletion of chromosome 11q predicts response to anthracycline-based chemotherapy in early breast cancer","Genome variation profiling by array","Homo sapiens",185,,"PDF;TXT","ftp://ftp.ncbi.nlm.nih.gov/geo/series/GSE6nnn/GSE6448/suppl",17234794,,"Joan Climent","Feb 07, 2007"
GSE6932,"Identification and characterization of small molecule inducers of epidermal keratinocyte differentiation","Expression profiling by array","Homo sapiens",18,GDS2732,"CEL","ftp://ftp.ncbi.nlm.nih.gov/geo/series/GSE6nnn/GSE6932/suppl",17348628,,"John R Walker","Feb 07, 2007"
GSE6960,"Synthesis and Anticancer Properties of Water-Soluble Zinc Ionophores 1","Expression profiling by array","Homo sapiens",12,,"CEL","ftp://ftp.ncbi.nlm.nih.gov/geo/series/GSE6nnn/GSE6960/suppl",18593933,,"Joseph Gerard Hacia","Feb 07, 2007"
GSE6962,"Synthesis and Anticancer Properties of Water-Soluble Zinc Ionophores 2","Expression profiling by array","Homo sapiens",12,,"CEL","ftp://ftp.ncbi.nlm.nih.gov/geo/series/GSE6nnn/GSE6962/suppl",18593933,,"Joseph Gerard Hacia","Feb 07, 2007"
GSE6972,"Synthesis and Anticancer Properties of Water-Soluble Zinc Ionophore: Cell Culture and Xenograft Model","Expression profiling by array","Homo sapiens",24,,"CEL","ftp://ftp.ncbi.nlm.nih.gov/geo/series/GSE6nnn/GSE6972/suppl",18593933,,"Joseph Gerard Hacia","Feb 07, 2007"
GSE6981,"The genomic landscape of histone modifications in human T cells.","Other","Homo sapiens",2,,,,17043231,,"Keji Zhao","Feb 07, 2007"
GSE5657,"Effect of X-linked hypophosphatemia (the Hyp mutation) on gene expression in the mid-shaft of the mouse femur","Expression profiling by array","Mus musculus",20,,"CEL;TXT;XLS","ftp://ftp.ncbi.nlm.nih.gov/geo/series/GSE5nnn/GSE5657/suppl",,,"Ralph A. Meyer","Feb 06, 2007"
GSE6499,"Microarray analyses that reveal the population of dendritic RNAs and their redistribution by neural activity","Expression profiling by array","Rattus norvegicus",4,,"TIFF;TXT","ftp://ftp.ncbi.nlm.nih.gov/geo/series/GSE6nnn/GSE6499/suppl",17207874,,"Mineo Matsumoto","Feb 06, 2007"
GSE6921,"Rice japonica gene expression array across eleven tissues","Expression profiling by genome tiling array","Oryza sativa",33,,"TXT","ftp://ftp.ncbi.nlm.nih.gov/geo/series/GSE6nnn/GSE6921/suppl",17372628,,"Xiangfeng Wang","Feb 06, 2007"
GSE6922,"Non-coding RNA tiling array in rice","Expression profiling by genome tiling array","Oryza sativa",1,,"TXT","ftp://ftp.ncbi.nlm.nih.gov/geo/series/GSE6nnn/GSE6922/suppl",17372628,,"Xiangfeng Wang","Feb 06, 2007"
GSE6931,"Expression data from female reproductive organs of adult mice treated with estrogen","Expression profiling by array","Mus musculus",12,,"CEL;EXP","ftp://ftp.ncbi.nlm.nih.gov/geo/series/GSE6nnn/GSE6931/suppl",17675804,,"Suzuki Atsuko","Feb 06, 2007"
GSE6952,"Ectodysplasin regulates the lymphotoxin-beta pathway for hair differentiation","Expression profiling by array","Mus musculus",36,,"TIFF;TXT","ftp://ftp.ncbi.nlm.nih.gov/geo/series/GSE6nnn/GSE6952/suppl",16738056,,"Minoru S.H. Ko","Feb 06, 2007"
GSE6974,"Active chromatin domains are defined by acetylation islands revealed by genome-wide mapping","Other","Homo sapiens",2,,,,15706033,,"Keji Zhao","Feb 06, 2007"
GSE6975,"High-resolution genome-wide mapping of histone modifications.","Other","Saccharomyces cerevisiae",4,,,,15235610,,"Keji Zhao","Feb 06, 2007"
GSE5316,"Microarray-based CGH in human lymphoma cell lines.","Genome variation profiling by array","Homo sapiens",48,,,,16960149,,"Jose Angel Martinez Climent","Feb 05, 2007"
GSE5342,"Expression data from Cerebral Cortex or Hippocampus of COX-1 or COX-2 null mice","Expression profiling by array","Mus musculus",30,GDS2602,"GEL","ftp://ftp.ncbi.nlm.nih.gov/geo/series/GSE5nnn/GSE5342/suppl",17266762,,"Christopher Dennis Toscano","Feb 05, 2007"
GSE6881,"Embryonic Testis Developmental Time Course","Expression profiling by array","Mus musculus",10,,"CEL;EXP","ftp://ftp.ncbi.nlm.nih.gov/geo/series/GSE6nnn/GSE6881/suppl",15496517,,"Lizhong Yang","Feb 05, 2007"
GSE6882,"Embryonic Ovary Developmental Time Course","Expression profiling by array","Mus musculus",10,,"CEL;EXP","ftp://ftp.ncbi.nlm.nih.gov/geo/series/GSE6nnn/GSE6882/suppl",15496517,,"Lizhong Yang","Feb 05, 2007"
GSE6955,"Expression in Superior Frontal Gyrus of normal individuals or females of different ages affected by Rett syndrome","Expression profiling by array","Homo sapiens",6,GDS2613,"CEL;EXP","ftp://ftp.ncbi.nlm.nih.gov/geo/series/GSE6nnn/GSE6955/suppl",17309881,,"Valerie Matagne","Feb 05, 2007"
GSE6934,"Transcriptional comparison between whole kidneys from E14.5 Wnt4 mutants and wildtype mice (Mouse430_2 platform). (GUDMAP Series ID: 13)","Expression profiling by array","Mus musculus",4,,"CEL","ftp://ftp.ncbi.nlm.nih.gov/geo/series/GSE6nnn/GSE6934/suppl",19501082,,"GUDMAP Developers","Feb 03, 2007"
GSE6940,"Characterisation of the mouse megakaryocyte transcriptome","Expression profiling by SAGE","Mus musculus",1,,,,17186946,,"Michael Graham Tomlinson","Feb 03, 2007"
GSE6411,"HP1 controls genomic targeting of four novel heterochromatin proteins in Drosophila","Genome binding/occupancy profiling by array","Drosophila melanogaster",35,,,,17255947,,"Bas van Steensel","Feb 02, 2007"
GSE6419,"Expression data from mouse bladder urothelium","Expression profiling by array","Mus musculus",8,GDS2977,"CEL","ftp://ftp.ncbi.nlm.nih.gov/geo/series/GSE6nnn/GSE6419/suppl",17504765,,"Christopher Swanson Reigstad","Feb 02, 2007"
GSE6425,"Expression data from time courses of E. coli MG1655 and UTI89 in vitro","Expression profiling by array","Escherichia coli;Escherichia coli K-12",44,,"CEL","ftp://ftp.ncbi.nlm.nih.gov/geo/series/GSE6nnn/GSE6425/suppl",17504765,,"Christopher Swanson Reigstad","Feb 02, 2007"
GSE6426,"E. coli expression data from gnotobiotic ceca 14d post-inoculation","Expression profiling by array","Escherichia coli;Escherichia coli K-12",10,,"CEL","ftp://ftp.ncbi.nlm.nih.gov/geo/series/GSE6nnn/GSE6426/suppl",17504765,,"Christopher Swanson Reigstad","Feb 02, 2007"
GSE6819,"Identification of genes that are linked with optineurin expression","Expression profiling by array","Homo sapiens",6,GDS2892,"CEL","ftp://ftp.ncbi.nlm.nih.gov/geo/series/GSE6nnn/GSE6819/suppl",17663987,,"Nicole Weisschuh","Feb 02, 2007"
GSE3506,"Differential gene expression of IMR32 cells expressing 69-kDa or 82-kDa CHAT proteins","Expression profiling by array","Homo sapiens",9,,,,,,"Sandeep K Gill","Feb 01, 2007"
GSE5501,"Comparison of protein expression profiles in NCI-60 cell panel containing nine difererent cancer tissue types.","Protein profiling by protein array","Homo sapiens",176,,,,14623978;20053763,,"Uma T Shankavaram","Feb 01, 2007"
GSE5872,"SR proteins in Drosophila","Expression profiling by array","Drosophila melanogaster",12,,,,17283056,,"johann Soret","Feb 01, 2007"
GSE5969,"Characterizing the expression of human olfactory receptor genes","Expression profiling by array","Canis lupus familiaris;Homo sapiens;Pan troglodytes;Rattus norvegicus",16,,"CEL","ftp://ftp.ncbi.nlm.nih.gov/geo/series/GSE5nnn/GSE5969/suppl",17509148,,"Omar De la Cruz","Feb 01, 2007"
GSE5991,"Utricle Neomycin Timecourse","Expression profiling by array","Gallus gallus;Homo sapiens;Mus musculus",65,,"TXT","ftp://ftp.ncbi.nlm.nih.gov/geo/series/GSE5nnn/GSE5991/suppl",17565378,,"Kara Powder","Feb 01, 2007"
GSE6028,"Interference of PTS components with PrfA of L.monocytogenes","Expression profiling by array","Listeria monocytogenes",10,,,,17085572,,"Biju Joseph Ampattu","Feb 01, 2007"
GSE6029,"Cord Blood-Derived Mesenchymal Stem Cells with Distinct Growth Kinetics, Differentiation Potentials, Expression Profiles","Expression profiling by array","Homo sapiens",18,GDS3401;GDS3402,"CEL","ftp://ftp.ncbi.nlm.nih.gov/geo/series/GSE6nnn/GSE6029/suppl",17348805,,"Kenro Kusumi","Feb 01, 2007"
GSE6042,"DNA copy numbers of malignant glioma in culture","Genome variation profiling by genome tiling array","Homo sapiens",36,,"XLS","ftp://ftp.ncbi.nlm.nih.gov/geo/series/GSE6nnn/GSE6042/suppl",,,"Philip C De Witt Hamer","Feb 01, 2007"
GSE6050,"Cochlea Neomycin Timecourse","Expression profiling by array","Gallus gallus;Homo sapiens;Mus musculus",51,,"TXT","ftp://ftp.ncbi.nlm.nih.gov/geo/series/GSE6nnn/GSE6050/suppl",17565378,,"Kara Powder","Feb 01, 2007"
GSE6051,"Cochlea Laser Timecourse","Expression profiling by array","Gallus gallus;Homo sapiens;Mus musculus",77,,"TXT","ftp://ftp.ncbi.nlm.nih.gov/geo/series/GSE6nnn/GSE6051/suppl",17565378,,"Kara Powder","Feb 01, 2007"
GSE6052,"Utricle Laser Timecourse","Expression profiling by array","Gallus gallus;Homo sapiens;Mus musculus",33,,"TXT","ftp://ftp.ncbi.nlm.nih.gov/geo/series/GSE6nnn/GSE6052/suppl",17565378,,"Kara Powder","Feb 01, 2007"
GSE6227,"Expression data from rust or mock inoculated, fully expanded flag leaf halves","Expression profiling by array","Triticum aestivum",36,,"CEL","ftp://ftp.ncbi.nlm.nih.gov/geo/series/GSE6nnn/GSE6227/suppl",18944173,,"Jianfa Bai","Feb 01, 2007"
GSE6245,"Loss of a histone deacetylase dramatically alters the genomic distribution of Spo11p-catalyzed DNA breaks in yeast","Genome binding/occupancy profiling by genome tiling array","Saccharomyces cerevisiae",24,,"GPR","ftp://ftp.ncbi.nlm.nih.gov/geo/series/GSE6nnn/GSE6245/suppl",17360459,,"Jason D. Lieb","Feb 01, 2007"
GSE6277,"Increasing NADH oxidation reduces overflow metabolism in Saccharomyces cerevisiae ","Expression profiling by array","Saccharomyces cerevisiae;Schizosaccharomyces pombe",6,,"CEL","ftp://ftp.ncbi.nlm.nih.gov/geo/series/GSE6nnn/GSE6277/suppl",17287356,,"Goutham N Vemuri","Feb 01, 2007"
GSE6682,"Arabidopsis thaliana small RNAs sequences identified using high-throughput 454 sequencing technology","Non-coding RNA profiling by high throughput sequencing","Arabidopsis thaliana",14,,,,17298187;17299599;17400893,,"James C Carrington","Feb 01, 2007"
GSE6736,"Trafficking of mRNA from tomato to dodder","Expression profiling by array","Cuscuta pentagona;Solanum lycopersicum",10,,"CEL","ftp://ftp.ncbi.nlm.nih.gov/geo/series/GSE6nnn/GSE6736/suppl",17189329,,"James H Westwood","Feb 01, 2007"
GSE6782,"Natural killer T-cell characterization through gene expression profiling","Expression profiling by array","Mus musculus",16,,"TIFF;TXT;XML","ftp://ftp.ncbi.nlm.nih.gov/geo/series/GSE6nnn/GSE6782/suppl",17916165,,"Hans-Joachim Mollenkopf","Feb 01, 2007"
GSE6838,"Transcripts targeted by the microRNA-16 family cooperatively regulate cell cycle progression","Expression profiling by array","Homo sapiens",71,,,,17242205,,"Julja Burchard","Feb 01, 2007"
GSE6842,"Global analysis of the relationship between the binding of Bas1p and meiosis-specific double-strand DNA breaks in yeast","Genome binding/occupancy profiling by genome tiling array","Saccharomyces cerevisiae",11,,"GPR","ftp://ftp.ncbi.nlm.nih.gov/geo/series/GSE6nnn/GSE6842/suppl",16428454,,"Jason D. Lieb","Feb 01, 2007"
GSE6902,"Profiles of global gene expression in ionizing radiation-damaged human diploid fibroblasts ","Expression profiling by array","Homo sapiens",36,,"TXT","ftp://ftp.ncbi.nlm.nih.gov/geo/series/GSE6nnn/GSE6902/suppl",16581545,,"Tong Zhou","Feb 01, 2007"
GSE5122,"Identification of molecular predictors of response in a study of tipifarnib treatment in relapsed and refractory AML","Expression profiling by array","Homo sapiens",58,,"PDF","ftp://ftp.ncbi.nlm.nih.gov/geo/series/GSE5nnn/GSE5122/suppl",17404110,,"Jack Yu","Jan 31, 2007"
GSE5586,"Expression data from egy wildtype and mutant embryo comparison","Expression profiling by array","Danio rerio",10,GDS2550,,,17416673,,"Gerhard J Weber","Jan 31, 2007"
GSE6192,"Gene expression changes during murine mucosal mast cell in vitro differentiation","Expression profiling by array","Mus musculus",2,,"TXT","ftp://ftp.ncbi.nlm.nih.gov/geo/series/GSE6nnn/GSE6192/suppl",17292962,,"Zoltan Wiener","Jan 31, 2007"
GSE6586,"DGCR8 is required for microRNA maturation","Non-coding RNA profiling by array","Mus musculus",9,,"GPR","ftp://ftp.ncbi.nlm.nih.gov/geo/series/GSE6nnn/GSE6586/suppl",17259983,,"Robert Blelloch","Jan 31, 2007"
GSE6837,"Expression data from wild type (wt) and Ikbke knockout (Ikke) embryonic fibroblasts (EF)","Expression profiling by array","Mus musculus",12,,"CEL","ftp://ftp.ncbi.nlm.nih.gov/geo/series/GSE6nnn/GSE6837/suppl",17332413,,"Benjamin Robert tenOever","Jan 31, 2007"
GSE6841,"Recovery growth","Expression profiling by array","Oncorhynchus mykiss",43,,,,,,"Pierre-Yves Rescan","Jan 31, 2007"
GSE6879,"Dietary effect of SPI or Genistein alters rat mammary epithelial global gene expression profiles ","Expression profiling by array","Rattus norvegicus",10,GDS2616,"CEL","ftp://ftp.ncbi.nlm.nih.gov/geo/series/GSE6nnn/GSE6879/suppl",17341692,,"Ying Su","Jan 31, 2007"
GSE6889,"M. tuberculosis-M. bovis transcriptional comparison","Expression profiling by array","Mycobacterium tuberculosis;Mycobacterium tuberculosis variant bovis",4,,"GPR","ftp://ftp.ncbi.nlm.nih.gov/geo/series/GSE6nnn/GSE6889/suppl",17433778,,"Germán Rehren","Jan 31, 2007"
GSE6905,"Transcriptional profiling of Candida albicans delta-doa1 mutant ","Expression profiling by array","Candida albicans",3,,"GPR","ftp://ftp.ncbi.nlm.nih.gov/geo/series/GSE6nnn/GSE6905/suppl",17379712,,"Bernhard Hube","Jan 31, 2007"
GSE6910,"Which genes are expressed in Arabidopsis pollen.- Comparison between Columbia and WS pollen RNAs.","Expression profiling by array","Arabidopsis thaliana",2,,"GPR","ftp://ftp.ncbi.nlm.nih.gov/geo/series/GSE6nnn/GSE6910/suppl",,,"Véronique BRUNAUD","Jan 31, 2007"
GSE6914,"Gene expression associated with gemcitabine resistance and its reversal by bexarotene","Expression profiling by array","Homo sapiens",20,GDS2777,"CEL;EXP","ftp://ftp.ncbi.nlm.nih.gov/geo/series/GSE6nnn/GSE6914/suppl",17483357,,"Thomas Hermann","Jan 31, 2007"
GSE6916,"Embryonic Testis/Ovary Developmental Time Courses","Expression profiling by array","Mus musculus",20,GDS2719,"CEL;EXP","ftp://ftp.ncbi.nlm.nih.gov/geo/series/GSE6nnn/GSE6916/suppl",15496517,,"Lizhong Yang","Jan 31, 2007"
GSE6296,"Analysis of the exression and regulation of NleA-E in Escherichia coli O157:H7","Expression profiling by array","Escherichia coli",3,,,,17464049,,"Chrystala Constantinidou","Jan 30, 2007"
GSE6376,"Zymosan stimulation of MyD88-deficient bone marrow-derived macrophages","Expression profiling by array","Mus musculus",4,GDS2686,"CEL;EXP","ftp://ftp.ncbi.nlm.nih.gov/geo/series/GSE6nnn/GSE6376/suppl",17312158,,"Bruz Marzolf","Jan 30, 2007"
GSE6845,"ChIP-chip analyses of SWIRM1 and SWIRM2 across the S. pombe genome.","Genome binding/occupancy profiling by genome tiling array","Schizosaccharomyces pombe",4,,,,16990277,,"Shiv Grewal","Jan 30, 2007"
GSE6919,"Expression Data from Normal and Prostate Tumor Tissues","Expression profiling by array","Homo sapiens",504,GDS2545;GDS2546;GDS2547,"CEL","ftp://ftp.ncbi.nlm.nih.gov/geo/series/GSE6nnn/GSE6919/suppl",17430594;15254046,,"Federico Alberto Monzon","Jan 30, 2007"
GSE5222,"Expression data from retinoblastoma","Expression profiling by array","Homo sapiens",12,GDS2530,,,17210724,,"Ludger Klein-Hitpass","Jan 29, 2007"
GSE5658,"Conserved and distinct regulatory targets of Brn3a at different levels of the sensory axis","Expression profiling by array","Mus musculus",17,,,,17239249,,"Eric Turner","Jan 28, 2007"
GSE6863,"Immature dendritic cells under hypoxic condition","Expression profiling by array","Homo sapiens",6,GDS2750,"CEL","ftp://ftp.ncbi.nlm.nih.gov/geo/series/GSE6nnn/GSE6863/suppl",18314479,,"Paolo Fardin","Jan 27, 2007"
GSE1543,"top1","Expression profiling by array","Papaver somniferum",12,,,,15386001,,"Anthony Millgate","Jan 26, 2007"
GSE1887,"early developmental stages of sea bream","Expression profiling by array","Sparus aurata",20,,,,16046618,,"Elena Athina Sarropoulou","Jan 26, 2007"
GSE2064,"stress response","Expression profiling by array","Sparus aurata",2,,,,16046618,,"Elena Athina Sarropoulou","Jan 26, 2007"
GSE4014,"Pac1+/+ versus Pac1-/- in macrophages and mast cells","Expression profiling by array","Mus musculus",6,,,,16474395,,"Charles Reay Mackay","Jan 26, 2007"
GSE4567,"Endothelial cell culture with Chapel Hill Ultrafine particle","Expression profiling by array","Homo sapiens",8,GDS2565,"CEL","ftp://ftp.ncbi.nlm.nih.gov/geo/series/GSE4nnn/GSE4567/suppl",17450221,,"Edward Karoly","Jan 26, 2007"
GSE5947,"Hematopoietic reconstitution by multipotent adult progenitor cells: precursors to long-term hematopoietic stem cells","Expression profiling by array","Mus musculus",6,,"TIFF;TXT","ftp://ftp.ncbi.nlm.nih.gov/geo/series/GSE5nnn/GSE5947/suppl",17227908,,"Minoru S.H. Ko","Jan 26, 2007"
GSE6291,"Transcriptome Analysis Multipotent Adult Progenitor Cells (Affy)","Expression profiling by array","Mus musculus",6,,"CEL","ftp://ftp.ncbi.nlm.nih.gov/geo/series/GSE6nnn/GSE6291/suppl",17227908,,"Fernando Ulloa Montoya","Jan 26, 2007"
GSE6848,"Expression evolution in yeast genes of single-input modules is mainly due to changes in trans-acting factors","Expression profiling by array","Saccharomyces cerevisiae",1,,"GPR;PDF","ftp://ftp.ncbi.nlm.nih.gov/geo/series/GSE6nnn/GSE6848/suppl",,,"Huang-Mo Sung","Jan 26, 2007"
GSE6854,"Temporal transcriptional response of endothelial cells to aqueous cigarette smoke extract exposure","Expression profiling by array","Homo sapiens",6,,,,,,"Blair Henderson","Jan 26, 2007"
GSE6862,"Changes in transcription profile in pelvic organ fibroblasts in response to stretch","Expression profiling by array","Homo sapiens",3,,,,,,"Jerry A Styles","Jan 26, 2007"
GSE6867,"Expression data in the absence of Notch1 in hair follicles","Expression profiling by array","Mus musculus",6,GDS2848,"CEL","ftp://ftp.ncbi.nlm.nih.gov/geo/series/GSE6nnn/GSE6867/suppl",17611229,,"Raphael Kopan","Jan 26, 2007"
GSE6868,"Homocysteine induced alterations in gene expression in neural crest cells","Expression profiling by array","Gallus gallus",6,GDS2646,"CEL","ftp://ftp.ncbi.nlm.nih.gov/geo/series/GSE6nnn/GSE6868/suppl",17326132,,"Greg Bennett","Jan 26, 2007"
GSE6875,"Development of Regulatory T cell Precursors in the Absence of a Functional Foxp3 Protein","Expression profiling by array","Mus musculus",8,,"CEL","ftp://ftp.ncbi.nlm.nih.gov/geo/series/GSE6nnn/GSE6875/suppl",17273171,,"Marc Richard John Carlson","Jan 26, 2007"
GSE5048,"Gene Expression Profiling of Zebrafish Embryonic Retinal Pigment Epithelium in vivo.","Expression profiling by array","Danio rerio",6,GDS2556,"CEL;DAT","ftp://ftp.ncbi.nlm.nih.gov/geo/series/GSE5nnn/GSE5048/suppl",17251491,,"Yuk Fai Leung","Jan 25, 2007"
GSE6409,"Identify cis-regulatory modules for OCT4","Genome binding/occupancy profiling by genome tiling array","Homo sapiens",6,,"TXT","ftp://ftp.ncbi.nlm.nih.gov/geo/series/GSE6nnn/GSE6409/suppl",,,"Victor X Jin","Jan 25, 2007"
GSE6623,"FoxO are critical mediators of hematopoietic stem cell resistance to physiologic oxidative stress","Expression profiling by array","Mus musculus",12,GDS2720,"CEL","ftp://ftp.ncbi.nlm.nih.gov/geo/series/GSE6nnn/GSE6623/suppl",17254970,,"Christopher Sears","Jan 25, 2007"
GSE6624,"Identification of genes directly regulated by the oncogene ZNF217 using ChIP-chip assays","Genome binding/occupancy profiling by genome tiling array","Homo sapiens",11,,"TXT","ftp://ftp.ncbi.nlm.nih.gov/geo/series/GSE6nnn/GSE6624/suppl",17259635,,"Victor X Jin","Jan 25, 2007"
GSE6625,"Identification of genes directly regulated by the oncogene ZNF217 using ChIP-chip assays (Promoter Arrays)","Genome binding/occupancy profiling by genome tiling array","Homo sapiens",26,,"TXT","ftp://ftp.ncbi.nlm.nih.gov/geo/series/GSE6nnn/GSE6625/suppl",17259635,,"Victor X Jin","Jan 25, 2007"
GSE6627,"Identification of genes directly regulated by the oncogene ZNF217 using ChIP-chip assays (Expression Data)","Expression profiling by array","Homo sapiens",6,,,,17259635,,"Victor X Jin","Jan 25, 2007"
GSE6634,"Genes Directly Regulated by the Oncogene ZNF217 Using ChIP-chip Assays on ENCODE and Promoter Arrays and Expression Data","Expression profiling by array;Genome binding/occupancy profiling by genome tiling array","Homo sapiens",43,,"TXT","ftp://ftp.ncbi.nlm.nih.gov/geo/series/GSE6nnn/GSE6634/suppl",17259635,,"Victor X Jin","Jan 25, 2007"
GSE6681,"Foxp3 ablation in peripheral mature regulatory T cells","Expression profiling by array","Mus musculus",4,GDS2525,"CEL","ftp://ftp.ncbi.nlm.nih.gov/geo/series/GSE6nnn/GSE6681/suppl",17220892,,"Alexander Rudensky","Jan 25, 2007"
GSE6835,"A study of the differentiation of Murine ES cells [Scl+/hCD4 ES cells (Chung et al., 2002)] into hemangioblasts","Expression profiling by array","Mus musculus",4,,"CEL","ftp://ftp.ncbi.nlm.nih.gov/geo/series/GSE6nnn/GSE6835/suppl",17166922,,"kyunghee choi","Jan 25, 2007"
GSE6840,"Cytological and molecular responses of Medicago truncatula to Erysiphe pisi","Expression profiling by array","Medicago truncatula",18,,"GPR","ftp://ftp.ncbi.nlm.nih.gov/geo/series/GSE6nnn/GSE6840/suppl",,,"Kathryn A VandenBosch","Jan 25, 2007"
GSE5148,"Functional genomics of cactus host shifts in Drosophila mojavensis","Expression profiling by array","Drosophila mojavensis",10,,,,17107489,,"Luciano Matias Matzkin","Jan 24, 2007"
GSE5773,"RAD methods paper - Threespine Stickleback Lateral Plate Mapping","Other","Gasterosteus aculeatus",20,,,,17189378,,"Eric A Johnson","Jan 24, 2007"
GSE6238,"Mechanisms of Aging in Senescence-Accelerated Mice","Expression profiling by array","Mus musculus",27,GDS2654,"CEL","ftp://ftp.ncbi.nlm.nih.gov/geo/series/GSE6nnn/GSE6238/suppl",15960800,,"Jennifer Greenhall","Jan 24, 2007"
GSE6758,"HeLa/16E6 Cells (Wild-type E2-infected vs. Mock-infected)","Expression profiling by array","Homo sapiens",4,,"GPR","ftp://ftp.ncbi.nlm.nih.gov/geo/series/GSE6nnn/GSE6758/suppl",17182682,,"Kimberly Johung","Jan 24, 2007"
GSE6759,"HeLa/16E6 Cells (Wild-type E2-infected vs. Mutant E2-infected)","Expression profiling by array","Homo sapiens",4,,"GPR","ftp://ftp.ncbi.nlm.nih.gov/geo/series/GSE6nnn/GSE6759/suppl",17182682,,"Kimberly Johung","Jan 24, 2007"
GSE6760,"HeLa/16E6-16E7 Cells (Wild-type E2-infected vs. Mutant E2-infected)","Expression profiling by array","Homo sapiens",4,,"GPR","ftp://ftp.ncbi.nlm.nih.gov/geo/series/GSE6nnn/GSE6760/suppl",17182682,,"Kimberly Johung","Jan 24, 2007"
GSE6761,"HeLa/16E6-16E7d21-24 Cells (Wild-type E2-infected vs. Mutant E2-infected)","Expression profiling by array","Homo sapiens",4,,"GPR","ftp://ftp.ncbi.nlm.nih.gov/geo/series/GSE6nnn/GSE6761/suppl",17182682,,"Kimberly Johung","Jan 24, 2007"
GSE6762,"Replicative Senescence in Primary Fibroblasts","Expression profiling by array","Homo sapiens",4,,"GPR","ftp://ftp.ncbi.nlm.nih.gov/geo/series/GSE6nnn/GSE6762/suppl",17182682,,"Kimberly Johung","Jan 24, 2007"
GSE6801,"Transcriptional profiling of the protein phosphatase 2C family in yeast ","Expression profiling by array","Saccharomyces cerevisiae",10,,"GPR","ftp://ftp.ncbi.nlm.nih.gov/geo/series/GSE6nnn/GSE6801/suppl",16973600,,"Antonio Casamayor","Jan 24, 2007"
GSE6805,"Induced Senescence in HeLa Cells","Expression profiling by array","Homo sapiens",16,,"GPR","ftp://ftp.ncbi.nlm.nih.gov/geo/series/GSE6nnn/GSE6805/suppl",17182682,,"Kimberly Johung","Jan 24, 2007"
GSE6814,"Effect of Age on Gene Expression Profiles in Rhesus Monkey Bone Marrow-Derived Mesenchymal Stem Cells","Expression profiling by array","Homo sapiens;Macaca mulatta",11,,"CEL","ftp://ftp.ncbi.nlm.nih.gov/geo/series/GSE6nnn/GSE6814/suppl",17685434,,"Joseph Gerard Hacia","Jan 24, 2007"
GSE6771,"Temporal Cortex Control (mesial temporal lobe epilepsy control)","Expression profiling by array","Homo sapiens",10,,"TXT","ftp://ftp.ncbi.nlm.nih.gov/geo/series/GSE6nnn/GSE6771/suppl",17343748,,"Erin L. Heinzen","Jan 23, 2007"
GSE6773,"Temporal neocortex mesial temporal lobe epilepsy","Expression profiling by array","Homo sapiens",10,,"TXT","ftp://ftp.ncbi.nlm.nih.gov/geo/series/GSE6nnn/GSE6773/suppl",17343748,,"Erin L. Heinzen","Jan 23, 2007"
