Accession,Title,Series Type,Taxonomy,Sample Count,Datasets,Supplementary Types,Supplementary Links,PubMed ID,SRA Accession,Contact,Release Date
GSE5262,"Septic shock patients: outcome at D1 (24 hours after inclusion)","Expression profiling by array","Homo sapiens",14,,,,,,"Didier Payen de la Garanderie","Aug 01, 2006"
GSE5271,"Time evolution study of sepsis in patients at D1, D7 and D28 post-inclusion","Expression profiling by array","Homo sapiens",34,,,,,,"Didier Payen de la Garanderie","Aug 01, 2006"
GSE5300,"Expression data from alveolar type II epithelial cells","Expression profiling by array","Mus musculus",4,,,,,,"Robert Geffers","Aug 01, 2006"
GSE4812,"Expression data from Daudi cells stimulated with anti-CD40 and/or IL-4 for 6 hr with or without AICAR-pretreatment","Expression profiling by array","Homo sapiens",12,,,,,,"Hiroshi Fukasawa","Jul 31, 2006"
GSE4846,"Expression data from Daudi cells stimulated with anti-CD40 and/or IL-4 for 6 hr","Expression profiling by array","Homo sapiens",12,,,,,,"Hiroshi Fukasawa","Jul 31, 2006"
GSE5407,"Comparative transcript profiling of interaction events in Pinus sylvestris root tissues following challenge (15dpi).","Expression profiling by array","Pinus sylvestris;Pinus taeda",36,,"TXT","ftp://ftp.ncbi.nlm.nih.gov/geo/series/GSE5nnn/GSE5407/suppl",17669735;18381269,,"Chris Smith","Jul 31, 2006"
GSE5408,"Comparative transcript profiling of interaction events in Pinus sylvestris root tissues following challenge (5dpi).","Expression profiling by array","Pinus sylvestris;Pinus taeda",36,,"TXT","ftp://ftp.ncbi.nlm.nih.gov/geo/series/GSE5nnn/GSE5408/suppl",17669735;18381269,,"Chris Smith","Jul 31, 2006"
GSE5410,"Comparative transcriptome analysis of early interaction events in Scots pine root tissues following challenge","Expression profiling by array","Pinus sylvestris;Pinus taeda",108,,"TXT","ftp://ftp.ncbi.nlm.nih.gov/geo/series/GSE5nnn/GSE5410/suppl",17669735;18381269,,"Chris Smith","Jul 31, 2006"
GSE4585,"The zebrafish runzel mutant results in a novel muscular dystrophy phenotype due to a titin mutation","Expression profiling by array","Danio rerio",6,GDS2192,,,,,"Leta S Steffen","Jul 30, 2006"
GSE4117,"Effects of laughter on gene expression profiles of patients with type 2 diabetes","Expression profiling by array","Homo sapiens",8,,,,,,"Toshiro Saito","Jul 29, 2006"
GSE3793,"Comparison of Yersinia pestis from rat buboes and laboratory cultures","Expression profiling by array","Borreliella burgdorferi;Chlamydia trachomatis;Coxiella burnetii;Staphylococcus aureus;Streptococcus pyogenes;Yersinia pestis",30,,"CEL;DTT","ftp://ftp.ncbi.nlm.nih.gov/geo/series/GSE3nnn/GSE3793/suppl",16864791,,"Dan Sturdevant","Jul 28, 2006"
GSE4025,"Gene Expression Preferentially Regulated by Tamoxifen in Breast Cancer Cells","Expression profiling by array","Homo sapiens",17,GDS2367,,,16849584,,"Edmund C Chang","Jul 28, 2006"
GSE4045,"Classification of serrated colorectal tumors","Expression profiling by array","Homo sapiens",37,GDS2201,"CEL;EXP;RPT","ftp://ftp.ncbi.nlm.nih.gov/geo/series/GSE4nnn/GSE4045/suppl",16819509,,"Antti Kokko","Jul 28, 2006"
GSE4225,"Sox4 knockdown in ACC3 cells","Expression profiling by array","Homo sapiens",6,GDS2193,,,16636670,,"Christopher A. Moskaluk","Jul 28, 2006"
GSE4516,"Gene expression profiles in lung tissue of rats following exposure to mainstream cigarette smoke","Expression profiling by array","Rattus norvegicus",18,GDS2194;GDS2195,,,16870687,,"Jürgen Borlak","Jul 28, 2006"
GSE4644,"The kinetics of transcriptomic changes induced by cigarette smoke in rat lungs","Expression profiling by array","Rattus norvegicus",18,GDS2188,,,16870687,,"Bernhard Gerstmayer","Jul 28, 2006"
GSE4669,"Response of yeast to saponin treatment","Expression profiling by array","Saccharomyces cerevisiae",12,GDS2196,,,16870766,,"Michael Csukai","Jul 28, 2006"
GSE4671,"Microarray Analysis of the Delipidation of White Adipose Tissue of Mice Fed Conjugated Linoleic Acid","Expression profiling by array","Mus musculus",28,GDS2197,,,16868072,,"Chris LaRosa","Jul 28, 2006"
GSE4685,"Analysis of gene expression in rice mature leaf and cultured cell suspension using Rice SuperSAGE Array1","Expression profiling by array","Oryza sativa",2,,,,16721381,,"Hideo Matsumura","Jul 28, 2006"
GSE4686,"Analysis of gene expression in Nicotiana benthamiana following NbCD1- or NbCD3-overexpression using SuperSAGE Array1","Expression profiling by array","Nicotiana benthamiana",3,,,,16721381,,"Hideo Matsumura","Jul 28, 2006"
GSE4735,"E. coli Transcriptome Dynamics during the Transition from Anaerobic to Aerobic Conditions","Expression profiling by array","Escherichia coli;Escherichia coli K-12",4,GDS2364,"TXT","ftp://ftp.ncbi.nlm.nih.gov/geo/series/GSE4nnn/GSE4735/suppl",16857675,,"Jonathan Partridge","Jul 28, 2006"
GSE4775,"Array-Based Comparative Genome Hybridization in Clinical Genetics","Genome variation profiling by genome tiling array","Homo sapiens",12,,,,16857771,,"Anat Bar-Shira","Jul 28, 2006"
GSE4870,"Expression data from T65H translocation mice","Expression profiling by array","Mus musculus",45,GDS2281;GDS2282;GDS2283;GDS2284;GDS2285,"CEL;EXP","ftp://ftp.ncbi.nlm.nih.gov/geo/series/GSE4nnn/GSE4870/suppl",16855283;17967881,,"Reiner Schulz","Jul 28, 2006"
GSE5061,"Transcriptional Profile of Haemophilus influenzae: Effects of Iron and Heme","Expression profiling by array","Haemophilus influenzae Rd KW20",6,GDS2217,,,16855256,,"Timothy M VanWagoner","Jul 28, 2006"
GSE5169,"Temperature induced differentiation of piA immortalised cell line PrE2.8","Expression profiling by array","Homo sapiens",3,,,,,,"Ian Giddings","Jul 28, 2006"
GSE2814,"Expression profiling of liver tissue from (C57BL/6J X C3H/HeJ)F2 mice on ApoE null backgrounds","Expression profiling by array","Mus musculus",311,,,,16462940;16825664;16934000;18344982;19995791;20439777,,"Leslie Ingram-drake","Jul 27, 2006"
GSE2840,"No accelerated rate of protein evolution in male biased Drosophila pseudoobscura genes","Expression profiling by SAGE","Drosophila pseudoobscura",2,,,,16816428,,"Schlötterer Christian","Jul 27, 2006"
GSE4048,"Pseudomonas putida expression profiles at different stress conditions","Expression profiling by array","Pseudomonas putida",6,,"TXT","ftp://ftp.ncbi.nlm.nih.gov/geo/series/GSE4nnn/GSE4048/suppl",12534465;16707699,,"Burkhard Tummler","Jul 27, 2006"
GSE4228,"Nitric Oxide Activation of Erk Regulates the Stability and Translation of mRNA Transcripts Containing CU-Rich Elements","Expression profiling by array","Homo sapiens",56,,,,16757573,,"Shuibang Wang","Jul 27, 2006"
GSE4334,"DNaseI/Array GM06990","Genome binding/occupancy profiling by genome tiling array","Homo sapiens",1,,,,16791208;17571346,,"Michael Scott Kuehn","Jul 27, 2006"
GSE4748,"A cyanobacterial LPS antagonist prevents endotoxin shock and blocks sustained TLR4 stimulation","Expression profiling by array","Homo sapiens",10,GDS2216,,,16717116,,"Francesco Bertoni","Jul 27, 2006"
GSE5023,"The Insecticides Cyfluthrin & Chlorpyrifos Alter Expression of Genes with Diverse Functions in Primary Human Astrocytes","Expression profiling by array","Homo sapiens",9,GDS2215,,,16790487,,"Sarah Mense","Jul 27, 2006"
GSE5352,"Translation State Array Analysis of LPS Stimulated Human Endothelial Cells","Expression profiling by array","Homo sapiens",4,,,,,,"Douglas I. Schmid","Jul 27, 2006"
GSE5353,"Translation State Array Analysis of Insulin Stimulated Human Endothelial Cells","Expression profiling by array","Homo sapiens",4,,,,,,"Douglas I. Schmid","Jul 27, 2006"
GSE5354,"Translation State Array Analysis of TNF Stimulated Human Endothelial Cells","Expression profiling by array","Homo sapiens",4,,,,,,"Douglas I. Schmid","Jul 27, 2006"
GSE5382,"Transcriptional Response to Alcohol Exposure  in Drosophila melanogaster","Expression profiling by array","Drosophila melanogaster",15,GDS2485,,,17054780,,"Tatiana V Morozova","Jul 27, 2006"
GSE5385,"Translation State Array Analysis of Histamine Stimulated Human Endothelial Cells","Expression profiling by array","Homo sapiens",4,,,,,,"Douglas I. Schmid","Jul 27, 2006"
GSE5386,"Translation State Array Analysis of Serum Stimulated Human Endothelial Cells","Expression profiling by array","Homo sapiens",4,,,,,,"Douglas I. Schmid","Jul 27, 2006"
GSE5388,"Adult postmortem brain tissue (dorsolateral prefrontal cortex) from subjects with bipolar disorder and healthy controls","Expression profiling by array","Homo sapiens",61,GDS2190,"CEL","ftp://ftp.ncbi.nlm.nih.gov/geo/series/GSE5nnn/GSE5388/suppl",16894394,,"Sabine Bahn","Jul 27, 2006"
GSE5389,"Adult postmortem brain tissue (orbitofrontal cortex) from subjects with bipolar disorder and healthy controls","Expression profiling by array","Homo sapiens",21,GDS2191,"CEL","ftp://ftp.ncbi.nlm.nih.gov/geo/series/GSE5nnn/GSE5389/suppl",16894394,,"Sabine Bahn","Jul 27, 2006"
GSE5392,"Expression profiling of human adult postmortem brain tissue from subjects with bipolar disorder and healthy controls","Expression profiling by array","Homo sapiens",82,,"CEL","ftp://ftp.ncbi.nlm.nih.gov/geo/series/GSE5nnn/GSE5392/suppl",16894394,,"Sabine Bahn","Jul 27, 2006"
GSE5393,"Translation State Array Analysis","Expression profiling by array","Homo sapiens",24,,,,,,"Douglas I. Schmid","Jul 27, 2006"
GSE5402,"Signalling molecules in MEFs/FL","Expression profiling by SAGE","Mus musculus",1,,,,16741226,,"Kenneth R. Boheler","Jul 27, 2006"
GSE3000,"An Integrated Fingerprinting platform for the study of Chinese Medicineal Herb Cordyceps sinensis","Expression profiling by array","Homo sapiens",16,,"PDF","ftp://ftp.ncbi.nlm.nih.gov/geo/series/GSE3nnn/GSE3000/suppl",,,"ChengWei Chang","Jul 26, 2006"
GSE3302,"Fetal lung development ","Expression profiling by array","Rattus norvegicus",54,,,,16798779,,"Tingting Weng","Jul 26, 2006"
GSE3622,"Identification of Francisella tularensis genes affected by iron limitation","Expression profiling by array","Francisella tularensis",7,,"TXT","ftp://ftp.ncbi.nlm.nih.gov/geo/series/GSE3nnn/GSE3622/suppl",16790797,,"Eric J. Hansen","Jul 26, 2006"
GSE3894,"Heterozygous carriers of Nijmegen Breakage Syndrome Have a Distinct Gene Expression Phenotype.","Expression profiling by array","Homo sapiens",143,,"CEL","ftp://ftp.ncbi.nlm.nih.gov/geo/series/GSE3nnn/GSE3894/suppl",16809669,,"Michael Patrick Morley","Jul 26, 2006"
GSE5072,"Sex-dependent and STAT5b-dependent Liver Gene Expression","Expression profiling by array","Mus musculus",12,,,,16469768,,"David J. Waxman","Jul 26, 2006"
GSE5387,"Ethylene-insensitive5 encodes a 5'->3' exoribonuclease required for regulation of EIN3-targeting F-box proteins EBF1/2","Expression profiling by genome tiling array","Arabidopsis thaliana",24,,,,16920797,,"Joseph R. Ecker","Jul 26, 2006"
GSE3061,"Stratagene Universal Human RNA Hybridized to Affymetrix U133 Plus 2.0 and U133 A Chips","Expression profiling by array","Homo sapiens",10,,"CEL","ftp://ftp.ncbi.nlm.nih.gov/geo/series/GSE3nnn/GSE3061/suppl",16776839,,"Sean Yoder","Jul 25, 2006"
GSE3062,"Affymetrix U133 Plus 2.0 Arrays Hybridized With Varying Amounts of Starting Material","Expression profiling by array","Homo sapiens",12,GDS2204,"CEL","ftp://ftp.ncbi.nlm.nih.gov/geo/series/GSE3nnn/GSE3062/suppl",16776839,,"Sean Yoder","Jul 25, 2006"
GSE4785,"Nef transfection of Jurkat T cells","Expression profiling by array","Homo sapiens",6,GDS2164,,,16857233,,"Michael George","Jul 25, 2006"
GSE5357,"NHGRI Menin ChIP-Chip","Genome binding/occupancy profiling by genome tiling array","Homo sapiens",33,,,,16604156,,"Sean Davis","Jul 25, 2006"
GSE5368,"Himalaya v 292","Expression profiling by array","Hordeum vulgare;Triticum aestivum",4,,,,,,"Andrew Spriggs","Jul 25, 2006"
GSE5369,"Grain Hardness","Expression profiling by array","Hordeum vulgare;Triticum aestivum",27,,,,,,"Andrew Spriggs","Jul 25, 2006"
GSE5378,"Comparative Genome Analysis of Ureaplasma parvum Clinical Isolates","Genome variation profiling by array","Ureaplasma parvum",11,,,,,,"Andrew Victorovich Klubin","Jul 25, 2006"
GSE2981,"Transcriptional Profiling Implicates Novel Interactions between Abiotic Stress and Hormonal Responses in Thellungiella","Expression profiling by array","Thellungiella",24,,,,16500996,,"Barbara Moffatt","Jul 22, 2006"
GSE5333,"Gene expression profiling of whole epididymis in embryonic (gestational day 12, 14, 16 & 18) and postnatal day 2 mice. (GUDMAP Series ID: 4)","Expression profiling by array","Mus musculus",16,GDS2202,"CEL","ftp://ftp.ncbi.nlm.nih.gov/geo/series/GSE5nnn/GSE5333/suppl",,,"GUDMAP Developers","Jul 22, 2006"
GSE5334,"Gene expression profiling of whole ovary in embryonic (gestional day 11, 12, 14, 16 & 18) and postnatal day 2 mice. (GUDMAP Series ID: 5)","Expression profiling by array","Mus musculus",19,GDS2203,"CEL","ftp://ftp.ncbi.nlm.nih.gov/geo/series/GSE5nnn/GSE5334/suppl",,,"GUDMAP Developers","Jul 22, 2006"
GSE3017,"Global gene expression profiling of developing maize anthers","Expression profiling by array","Zea mays",144,GDS2474;GDS2475;GDS2477,"PDF","ftp://ftp.ncbi.nlm.nih.gov/geo/series/GSE3nnn/GSE3017/suppl",16731695,,"Patrick S. Schnable","Jul 21, 2006"
GSE3384,"Nemaline myopathy mouse model","Expression profiling by array","Mus musculus",36,GDS2312,"CEL;EXP","ftp://ftp.ncbi.nlm.nih.gov/geo/series/GSE3nnn/GSE3384/suppl",16877500,,"Despina Sanoudou","Jul 21, 2006"
GSE4963,"Heart Failure, DITPA and Captopril","Expression profiling by array","Rattus norvegicus",20,GDS2174,,,18030062,,"Niranjan Maitra","Jul 21, 2006"
GSE5370,"Myositis","Expression profiling by array","Homo sapiens",9,GDS2153,"CEL","ftp://ftp.ncbi.nlm.nih.gov/geo/series/GSE5nnn/GSE5370/suppl",,,"Eric Hoffman","Jul 21, 2006"
GSE5371,"Maternal BRG1 regulates zygotic genome activation in the mouse","Expression profiling by array","Mus musculus",8,GDS2156,,,16818606,,"Hua Pan","Jul 21, 2006"
GSE4406,"Gene expression profiling of CD4+ T-cells and GM6990 lymphoblastoid cell lines","Expression profiling by array","Homo sapiens",8,,,,16791207,,"Sean Davis","Jul 20, 2006"
GSE5030,"Expression Profiling of a CALM/AF10 leukemia mouse model","Expression profiling by array","Mus musculus",2,,"GPR","ftp://ftp.ncbi.nlm.nih.gov/geo/series/GSE5nnn/GSE5030/suppl",17097559,,"Hendrik Reuter","Jul 20, 2006"
GSE5318,"Planarian stem cells","Expression profiling by array","Dugesia japonica",28,,"GPR;TXT","ftp://ftp.ncbi.nlm.nih.gov/geo/series/GSE5nnn/GSE5318/suppl",17445279,,"Leonardo Rossi","Jul 19, 2006"
GSE5315,"Estrogen response after stroke","Expression profiling by array","Rattus norvegicus",4,GDS2311,,,16971488,,"Nabil J. Alkayed","Jul 18, 2006"
GSE5317,"Expression analysis of Day 0 versus Day 1 involuting mouse mammary gland","Expression profiling by array","Mus musculus",2,,,,17127459,,"Yvonne Myal","Jul 18, 2006"
GSE4261,"Antagonism between two mechanisms of antifungal drug resistance","Expression profiling by array","Saccharomyces cerevisiae",26,,,,16896209,,"James B Anderson","Jul 15, 2006"
GSE5196,"Detection of gene expression in Anopheles gambiae whole adults","Expression profiling by array","Anopheles gambiae",10,,,,,,"Joelle R Perusse","Jul 15, 2006"
GSE5309,"Transcriptional Profiling of Mammary Gland Side Population Cells","Expression profiling by array","Mus musculus",7,GDS2157,"CEL;XLS","ftp://ftp.ncbi.nlm.nih.gov/geo/series/GSE5nnn/GSE5309/suppl",16282442,,"Fariba Behbod","Jul 15, 2006"
GSE3407,"Cockayne syndrome (CSB) fibroblasts","Expression profiling by array","Homo sapiens",16,GDS2175;GDS2176,"CEL","ftp://ftp.ncbi.nlm.nih.gov/geo/series/GSE3nnn/GSE3407/suppl",16772382,,"John C Newman","Jul 14, 2006"
GSE3573,"Transcriptional effect of various iron treatments on Caco-2 cells.","Expression profiling by array","Homo sapiens",12,GDS2230,,,16638840,,"chicault celine","Jul 14, 2006"
GSE3707,"Expression profiling of bronchial epithelium","Expression profiling by SAGE","Homo sapiens",19,,,,,,"Kim Marie Lonergan","Jul 14, 2006"
GSE3745,"Comparison of WT Vs NaS1-/- livers ","Expression profiling by array","Mus musculus",4,,,,16621889,,"Sean M Grimmond","Jul 14, 2006"
GSE3763,"Expression Profiling of Spalax ehrenbergi: bioprospecting for hypoxia tolerance","Expression profiling by array","Mus musculus;Nannospalax ehrenbergi;Nannospalax galili;Nannospalax judaei",12,,,,16788006,,"Mark Robert Band","Jul 14, 2006"
GSE4464,"Expression in Primary Effusion Lymphoma (PEL) BCBL-1 compared to BJAB (BL cell line) and  L-428 (cHD cell line)","Expression profiling by array","Homo sapiens",4,,,,16709867,,"Eduardo Hernandez","Jul 14, 2006"
GSE4648,"Earliest Changes in the Left Ventricular Transcriptome Post-Myocardial Infarction","Expression profiling by array","Mus musculus",198,GDS2329;GDS2330;GDS2331,"CEL","ftp://ftp.ncbi.nlm.nih.gov/geo/series/GSE4nnn/GSE4648/suppl",16845475,,"Mark Stayton","Jul 14, 2006"
GSE5132,"Molecular Correlate to Gleason Grade in Prostate Adenocarcinoma","Expression profiling by array","Homo sapiens",32,GDS2171,"GPR","ftp://ftp.ncbi.nlm.nih.gov/geo/series/GSE5nnn/GSE5132/suppl",16829574,,"Denise Mauldin","Jul 14, 2006"
GSE5298,"Development of heart valves requires Gata4 expression in endothelial-derived cells","Expression profiling by array","Mus musculus",8,GDS3663,"CEL","ftp://ftp.ncbi.nlm.nih.gov/geo/series/GSE5nnn/GSE5298/suppl",16914500,,"Sek Won Kong","Jul 14, 2006"
GSE2930,"5'DFUR treatment in MCF7. Effect at 4 hours","Expression profiling by array","Homo sapiens",14,,,,16965766,,"Miriam Molina-Arcas","Jul 13, 2006"
GSE2931,"5'DFUR treatment in MCF7. Effect at 24 hours","Expression profiling by array","Homo sapiens",16,,,,16965766,,"Miriam Molina-Arcas","Jul 13, 2006"
GSE5293,"Crassostrea array characterization","Expression profiling by array","Crassostrea ariakensis;Crassostrea gigas;Crassostrea virginica",15,,,,,,"MarineGenomics Project","Jul 13, 2006"
GSE5304,"Murine EDMD","Expression profiling by array","Mus musculus",23,GDS2158,"CEL","ftp://ftp.ncbi.nlm.nih.gov/geo/series/GSE5nnn/GSE5304/suppl",,,"Eric Hoffman","Jul 13, 2006"
GSE5305,"p68 SMC differentiation","Expression profiling by array","Mus musculus",24,GDS2151;GDS2152,"CEL","ftp://ftp.ncbi.nlm.nih.gov/geo/series/GSE5nnn/GSE5305/suppl",,,"Eric Hoffman","Jul 13, 2006"
GSE5306,"Murine Spleen","Expression profiling by array","Mus musculus",12,GDS2150,"CEL","ftp://ftp.ncbi.nlm.nih.gov/geo/series/GSE5nnn/GSE5306/suppl",,,"Eric Hoffman","Jul 13, 2006"
GSE2924,"Immunodomination leads to selective expansion of the fittest CD8 T cells ","Expression profiling by array","Mus musculus",13,,,,,,"Etienne Caron","Jul 12, 2006"
GSE5273,"Clenbuterol, X-ray and Tempol treatments on Contusion Rat model","Expression profiling by array","Rattus norvegicus",22,,,,,,"koko murakami midelfort","Jul 12, 2006"
GSE5282,"Astrocytes in response to activation of EGFR","Expression profiling by array","Rattus norvegicus",12,GDS2146,"CEL","ftp://ftp.ncbi.nlm.nih.gov/geo/series/GSE5nnn/GSE5282/suppl",16837601,,"Bin Liu","Jul 12, 2006"
GSE5289,"Comparative transcriptional profiling of the lung discriminates S. pneumoniae and Influenza A Virus infections","Expression profiling by array","Mus musculus",7,GDS2165,,,17163962,,"Hans-Joachim Mollenkopf","Jul 12, 2006"
GSE5290,"Temperature sensitive eIF5A mutant shows accumulation of transcripts targeted to the Nonsense Mediated Decay pathway","Expression profiling by array","Saccharomyces cerevisiae",8,,"CEL;EXP","ftp://ftp.ncbi.nlm.nih.gov/geo/series/GSE5nnn/GSE5290/suppl",16987817,,"Rainer Schrader","Jul 12, 2006"
GSE5296,"Spinal Cord Injury Murine Model","Expression profiling by array","Mus musculus",96,GDS2159,"CEL","ftp://ftp.ncbi.nlm.nih.gov/geo/series/GSE5nnn/GSE5296/suppl",,,"Eric Hoffman","Jul 12, 2006"
GSE4391,"Expression data from primitive and maturing hematopoietic stem cells","Expression profiling by array","Mus musculus",2,,"CEL","ftp://ftp.ncbi.nlm.nih.gov/geo/series/GSE4nnn/GSE4391/suppl",16574753,,"Ludger Klein-Hitpass","Jul 11, 2006"
GSE5267,"Tetracyclines Specifically Target the Apicoplast of the Malaria Parasite Plasmodium falciparum","Expression profiling by array","Plasmodium falciparum;Saccharomyces cerevisiae",24,,,,16940111,,"Joseph L DeRisi","Jul 11, 2006"
GSE5099,"Expression Data from Macrophage Maturation and Polarization Experiment","Expression profiling by array","Homo sapiens",30,GDS2429;GDS2430,"CEL","ftp://ftp.ncbi.nlm.nih.gov/geo/series/GSE5nnn/GSE5099/suppl",17082649;20530259,,"Fernando O Martinez Estrada","Jul 10, 2006"
GSE5281,"Alzheimer's disease and the normal aged brain (steph-affy-human-433773)","Expression profiling by array","Homo sapiens",161,,"CEL;CHP;XLS","ftp://ftp.ncbi.nlm.nih.gov/geo/series/GSE5nnn/GSE5281/suppl",17077275;18332434;29937276,,"Winnie Liang","Jul 10, 2006"
GSE4793,"Sex-specific gene expression in the mouse heart","Expression profiling by array","Mus musculus",8,,,,,,"Joerg Isensee","Jul 09, 2006"
GSE4795,"Sex-specific gene expression in the human left ventricle","Expression profiling by array","Homo sapiens",8,,,,,,"Joerg Isensee","Jul 09, 2006"
GSE2898,"Nuclear growth hormone receptor","Expression profiling by array","Mus musculus",12,,,,17690250,,"Agnieszka Maria Lichanska","Jul 08, 2006"
GSE5203,"Mouse colon development series","Expression profiling by array","Mus musculus",42,,,,17615082,,"Bruce J Aronow","Jul 08, 2006"
GSE5204,"Mouse models of human colon cancer and mouse colon development","Expression profiling by array","Mus musculus",79,,,,17615082,,"Bruce J Aronow","Jul 08, 2006"
GSE5229,"Cross-regulation between Notch and p63 in keratinocyte commitment to differentiation","Expression profiling by array","Homo sapiens;Mus musculus",4,,,,16618808,,"G.Paolo Dotto","Jul 08, 2006"
GSE5249,"Profiling limb muscle degeneration by inducible dominant negative thyroid hormone receptor transgene over-expression","Expression profiling by array","Xenopus laevis",12,GDS2120,"TXT","ftp://ftp.ncbi.nlm.nih.gov/geo/series/GSE5nnn/GSE5249/suppl",17234173,,"Biswajit Das","Jul 08, 2006"
GSE5255,"Loss of BMPR2 Signaling in Smooth Muscle in Mouse Lung","Expression profiling by array","Mus musculus",6,GDS2147,,,17369292,,"James West","Jul 08, 2006"
GSE5261,"Global activation of embryonic colon gene expression in murine colon tumor models and human colorectal cancer","Expression profiling by array","Homo sapiens;Mus musculus",226,,,,17615082,,"Bruce J Aronow","Jul 08, 2006"
GSE5264,"Human bronchial epithelial cell differentiation time course","Expression profiling by array","Homo sapiens",30,GDS2615,"CEL","ftp://ftp.ncbi.nlm.nih.gov/geo/series/GSE5nnn/GSE5264/suppl",17413031,,"Andrea Ross","Jul 08, 2006"
GSE3086,"Expression profiling of Adipose tissue from (C57BL/6J X C3H/HeJ)F2 mice on ApoE null backgrounds","Expression profiling by array","Mus musculus",295,,,,16825664;18344982;20439777,,"Leslie Ingram-drake","Jul 07, 2006"
GSE3087,"Expression profiling of brain tissue from (C57BL/6J X C3H/HeJ)F2 mice on ApoE null backgrounds","Expression profiling by array","Mus musculus",249,,,,16825664;20439777,,"Leslie Ingram-drake","Jul 07, 2006"
GSE3088,"Expression profiling of Muscle tissue from (C57BL/6J X C3H/HeJ)F2 mice on ApoE null backgrounds","Expression profiling by array","Mus musculus",319,,,,16825664;20439777,,"Leslie Ingram-drake","Jul 07, 2006"
GSE4953,"Expression data from NOD-scid vs B6-scid pancreas, submandibular glands, & lacrimal glands","Expression profiling by array","Mus musculus",117,GDS2177;GDS2178;GDS2179,,,16895987,,"Rodolfo Chaparro","Jul 07, 2006"
GSE5007,"Expression data for LMF","Expression profiling by array","Homo sapiens",6,GDS3089,"CEL","ftp://ftp.ncbi.nlm.nih.gov/geo/series/GSE5nnn/GSE5007/suppl",16859521,,"Dave Peck","Jul 07, 2006"
GSE5131,"Adjudin-induced germ cell loss from adult rat testes","Expression profiling by array","Rattus norvegicus",8,GDS2119,"CEL;EXP","ftp://ftp.ncbi.nlm.nih.gov/geo/series/GSE5nnn/GSE5131/suppl",17332525,,"Weiliang Xia","Jul 07, 2006"
GSE5191,"Determine the extent of inter-species hybridization in adult parasites.","Expression profiling by array","Schistosoma japonicum;Schistosoma mansoni",4,,,,16631746,,"Russell Leigh McInnes","Jul 07, 2006"
GSE5198,"Transcriptional profiling of mouse ileum in response to colonization with a zebrafish or mouse gut microbiota ","Expression profiling by array","Mus musculus",18,,"CEL","ftp://ftp.ncbi.nlm.nih.gov/geo/series/GSE5nnn/GSE5198/suppl",17055441,,"John F Rawls","Jul 07, 2006"
GSE5216,"GAS41 over-expression in Saos2 Tet-Off cells","Expression profiling by array","Homo sapiens",12,GDS2170,,,,,"Sabrina M. Heisel","Jul 07, 2006"
GSE5234,"Examine strain and gender associated gene expression in Schistosoma japonicum","Expression profiling by array","Schistosoma japonicum;Schistosoma mansoni",12,,,,16647836,,"Russell Leigh McInnes","Jul 07, 2006"
GSE5235,"Determine the extent of similarity of gene expression in in-vitro compared to in-vivo grown Schistosomes.","Expression profiling by array","Schistosoma japonicum;Schistosoma mansoni",5,,,,16570121,,"Russell Leigh McInnes","Jul 07, 2006"
GSE5239,"Expression data from Escherichia coli","Expression profiling by array","Escherichia coli;Escherichia coli K-12",24,,,,17112383,,"Dr Zhijun Wang, Ph.D","Jul 07, 2006"
GSE5254,"Arabidopsis stn7 and stn8 single and double mutants vs WT","Expression profiling by array","Arabidopsis thaliana",36,GDS2109,,,15656970;16237446,,"christos Noutsos","Jul 07, 2006"
GSE2891,"Transcriptional response to nitrogen availability in yeast","Expression profiling by array","Saccharomyces cerevisiae",20,,,,16879428,,"Bart Scherens","Jul 06, 2006"
GSE3314,"Stability of meiosis-specific messenger RNA provides a novel paradigm for the regulation of meiosis","Expression profiling by array","Schizosaccharomyces pombe",4,GDS3014,,,16823445,,"Yuji Chikashige","Jul 06, 2006"
